{
  "schema_version": "1.0",
  "summary": "Daedalus is an authenticated local-development workspace in which a Next.js client and local daemon coordinate through Supabase. The daemon discovers feature and parameter files, supervises feature processes and agent worktrees, records durable outcomes, and generates validated Architecture Views; the client presents those states with ventures and operational controls.",
  "systems": [
    {
      "id": "supabase_coordination",
      "name": "Supabase Communication and Review Protocol",
      "summary": "User-scoped Supabase tables, RPCs, row-level policies, and recipient-review states provide the durable coordination plane for browser, daemon, and daemon-manager work while bounding recurrent payload transfer.",
      "files": [
        "supabase/migrations/008_auth_scoped_daedalus.sql",
        "supabase/migrations/013_recurrent_row_review_protocol.sql",
        "supabase/migrations/014_complete_recurrent_row_review_protocol.sql",
        "supabase/migrations/023_complete_recurrent_supabase_read_hardening.sql",
        "supabase/migrations/027_recurrent_supabase_egress_remediation.sql",
        "shared/database/schema.sql",
        "local-daemon/src/daedalus_daemon/communications.py",
        "feature_files/auth-scoped-supabase-access.md",
        "feature_files/feature-file-communications-system.md",
        "feature_files/recurrent-row-review-protocol.md"
      ]
    },
    {
      "id": "workspace_discovery",
      "name": "Workspace Discovery and Feature Graph",
      "summary": "The local daemon scans canonical project feature and parameter files, and the workspace renders feature-only graph navigation with paired parameter editing and project-qualified feature selection.",
      "files": [
        "local-daemon/src/daedalus_daemon/scanner.py",
        "daedalus-site/app/feature-files-dashboard.tsx",
        "daedalus-site/app/feature-file-graph.tsx",
        "daedalus-site/app/parameter-variable-selector.tsx",
        "daedalus-site/lib/feature-file-cache.ts",
        "daedalus-site/lib/parameter-file-cache.ts",
        "daedalus-site/lib/parameter-file-parser.ts",
        "feature_files/dev-environment-parameter-file-loading.md",
        "feature_files/feature-file-graph-display.md"
      ]
    },
    {
      "id": "agent_prompt_chat",
      "name": "Agent Prompt Chat",
      "summary": "The Edit surface composes and submits standard, planning, and ask prompts with model, reasoning, project, and feature targeting; it delegates status, response, and archive presentation to the output viewer.",
      "files": [
        "daedalus-site/app/agent-session-panel.tsx",
        "daedalus-site/app/feature-files-dashboard.tsx",
        "daedalus-site/app/feature-search-dialog.tsx",
        "daedalus-site/lib/agent-models.ts",
        "daedalus-site/config/agent_models.json",
        "feature_files/agent-prompt-chat.md"
      ]
    },
    {
      "id": "agent_worktree_orchestration",
      "name": "Daedalus Git Worktrees",
      "summary": "A durable daemon orchestrator admits standard agent tasks into isolated Git worktrees, runs repair and verification loops, coordinates task cohorts and integration branches, and promotes only verified local main-line results.",
      "files": [
        "local-daemon/src/daedalus_daemon/orchestrator.py",
        "local-daemon/src/daedalus_daemon/main.py",
        "local-daemon/src/daedalus_daemon/communications.py",
        "parameter_files/daedalus-git-worktrees.toml",
        "supabase/migrations/009_git_worktree_orchestrator.sql",
        "supabase/migrations/030_task_and_batch_failure_recovery.sql",
        "supabase/migrations/034_blocked_batch_task_reservation.sql",
        "supabase/migrations/036_preserve_batch_retry_worktree.sql",
        "feature_files/daedalus-git-worktrees.md"
      ]
    },
    {
      "id": "migration_deployment",
      "name": "Supabase Migration Deployment",
      "summary": "For a verified integration batch, the daemon validates canonical migration files and, when explicitly enabled and allowlisted, serializes Supabase CLI preflight and deployment with redacted diagnostics and recovery-aware blocking behavior.",
      "files": [
        "local-daemon/src/daedalus_daemon/migration_deployment.py",
        "local-daemon/src/daedalus_daemon/orchestrator.py",
        "parameter_files/supabase-migration-deployment.toml",
        "supabase/config.toml",
        "supabase/migrations/",
        "shared/database/README.md",
        "feature_files/supabase-migration-deployment.md"
      ]
    },
    {
      "id": "feature_execution",
      "name": "Feature Execution System",
      "summary": "The daemon validates a feature-owned Python entry point, supervises its process asynchronously, captures bounded diagnostics, and persists independently cancellable execution-run lifecycle state.",
      "files": [
        "local-daemon/src/daedalus_daemon/execution.py",
        "local-daemon/src/daedalus_daemon/main.py",
        "local-daemon/src/daedalus_daemon/communications.py",
        "daedalus-site/app/entry-point-picker.tsx",
        "daedalus-site/app/feature-workspace-utils.ts",
        "supabase/migrations/017_feature_execution_runs.sql",
        "supabase/migrations/018_feature_execution_entry_point_metadata.sql",
        "feature_files/feature-execution-system.md"
      ]
    },
    {
      "id": "git_sync",
      "name": "Git Sync",
      "summary": "The workspace submits explicit commit, sync, and status requests for a selected repository, and the local daemon executes fixed Git command arrays and returns requested status or failure diagnostics through the coordination plane.",
      "files": [
        "daedalus-site/app/git-sync-panel.tsx",
        "daedalus-site/app/git-sync-utils.ts",
        "local-daemon/src/daedalus_daemon/main.py",
        "local-daemon/src/daedalus_daemon/communications.py",
        "supabase/migrations/012_allow_git_sync_results.sql",
        "feature_files/git-sync.md"
      ]
    },
    {
      "id": "daemon_management",
      "name": "Local Daemon Manager",
      "summary": "A lease-backed supervisor owns the execution daemon process lifecycle, admission gating, restart draining, crash recovery, and health publication for a user-scoped local execution layer.",
      "files": [
        "local-daemon-manager/src/daedalus_daemon_manager/",
        "daedalus-site/app/daemon-manager-panel.tsx",
        "parameter_files/local-daemon-manager.toml",
        "supabase/migrations/021_local_daemon_manager.sql",
        "feature_files/local-daemon-manager.md"
      ]
    },
    {
      "id": "agent_output_viewer",
      "name": "Agent Output Viewer",
      "summary": "The authenticated history workspace merges active prompt and task state with durable per-prompt archive records, keeping implementation output, planning exchanges, terminal errors, retries, and blocked integration batches distinct.",
      "files": [
        "daedalus-site/app/agent-output-viewer.tsx",
        "daedalus-site/app/agent-output-detail.tsx",
        "daedalus-site/lib/agent-output-history.ts",
        "supabase/migrations/019_agent_output_history.sql",
        "supabase/migrations/020_allow_agent_output_history_delete.sql",
        "supabase/migrations/022_planning_conversation_history.sql",
        "supabase/migrations/035_agent_output_viewer_reliability.sql",
        "feature_files/agent-output-viewer.md"
      ]
    },
    {
      "id": "architecture_generation",
      "name": "System Architecture Communication Engine",
      "summary": "The daemon creates task-scoped Architecture View requests from immutable task commit boundaries, feature-file ownership candidates, and Graphify evidence, then manages generation-scoped progress and persistence handoff.",
      "files": [
        "local-daemon/src/daedalus_daemon/architecture.py",
        "local-daemon/src/daedalus_daemon/architecture_document.py",
        "parameter_files/system-architecture-communication-engine.toml",
        "supabase/migrations/028_system_architecture_communication_engine.sql",
        "feature_files/system-architecture-communication-engine.md"
      ]
    },
    {
      "id": "architecture_visualization",
      "name": "System Architecture Visualization Engine",
      "summary": "A strict versioned architecture-document contract validates normalized system and channel data, and the workspace deterministically lays it out as an SVG diagram with current-generation progress states.",
      "files": [
        "shared/schemas/software-architecture-v1.schema.json",
        "local-daemon/src/daedalus_daemon/architecture_document.py",
        "daedalus-site/lib/architecture-view.ts",
        "daedalus-site/lib/architecture-layout.ts",
        "daedalus-site/app/architecture-visualization.tsx",
        "parameter_files/system-architecture-visualization-engine.toml",
        "supabase/migrations/029_system_architecture_visualization_engine.sql",
        "feature_files/system-architecture-visualization-engine.md"
      ]
    },
    {
      "id": "ventures",
      "name": "Ventures",
      "summary": "The workspace provides an authenticated drawer for user-owned venture records, including progress, project and feature-file tags, optional details, and guarded clearing of completed entries.",
      "files": [
        "daedalus-site/app/feature-files-dashboard.tsx",
        "parameter_files/ventures.toml",
        "supabase/migrations/004_create_ventures_table.sql",
        "supabase/migrations/006_add_project_directory_to_ventures.sql",
        "supabase/migrations/007_add_feature_file_paths_to_ventures.sql",
        "feature_files/ventures.md"
      ]
    }
  ],
  "channels": [
    {
      "id": "workspace_load_requests",
      "name": "Workspace Discovery Requests",
      "summary": "The workspace requests feature and parameter inventories through user-scoped communication rows that the daemon consumes as reviewable work.",